<?xml version="1.0" encoding="UTF-8"?>
<xsd:schema attributeFormDefault="unqualified" elementFormDefault="qualified"
            xmlns:xsd="http://www.w3.org/2001/XMLSchema">
    <xsd:element name="mappings" type="mappingsType"/>
    <xsd:complexType name="mappingsType">
        <xsd:sequence>
            <xsd:element type="mappingType" name="mapping" maxOccurs="unbounded" minOccurs="1"/>
        </xsd:sequence>
    </xsd:complexType>
    <xsd:complexType name="inputType">
        <xsd:sequence>
            <xsd:element name="path" minOccurs="1" maxOccurs="1">
                <xsd:simpleType>
                    <xsd:restriction base="xsd:string">
                        <xsd:pattern value=".+"/>
                    </xsd:restriction>
                </xsd:simpleType>
            </xsd:element>
            <xsd:element type="serverType" name="server" minOccurs="0" maxOccurs="1"/>
        </xsd:sequence>
    </xsd:complexType>
    <xsd:complexType name="outputType">
        <xsd:sequence>
            <xsd:element name="path" minOccurs="1" maxOccurs="1">
                <xsd:simpleType>
                    <xsd:restriction base="xsd:string">
                        <xsd:pattern value=".+"/>
                    </xsd:restriction>
                </xsd:simpleType>
            </xsd:element>
            <xsd:element type="serverType" name="server" minOccurs="0" maxOccurs="1"/>
        </xsd:sequence>
    </xsd:complexType>
    <xsd:complexType name="mappingType">
        <xsd:sequence>
            <xsd:element name="serviceType">
                <xsd:simpleType>
                    <xsd:restriction base="xsd:string">
                        <xsd:pattern value=".{5,20}"/>
                    </xsd:restriction>
                </xsd:simpleType>
            </xsd:element>
            <xsd:element name="id">
                <xsd:simpleType>
                    <xsd:restriction base="xsd:string">
                        <xsd:pattern value=".{1,20}"/>
                    </xsd:restriction>
                </xsd:simpleType>
            </xsd:element>
            <xsd:element type="outputType" name="output" minOccurs="0"/>
            <xsd:element type="inputType" name="input" minOccurs="0"/>
        </xsd:sequence>
    </xsd:complexType>
    <xsd:complexType name="serverType">
        <xsd:annotation>
            <xsd:documentation>Server Information</xsd:documentation>
        </xsd:annotation>
        <xsd:sequence>
            <xsd:element name="protocol" minOccurs="1" maxOccurs="1">
                <xsd:simpleType>
                    <xsd:restriction base="xsd:string">
                        <xsd:pattern value="sftp"/>
                    </xsd:restriction>
                </xsd:simpleType>
            </xsd:element>
            <xsd:element name="host" minOccurs="1" maxOccurs="1">
                <xsd:simpleType>
                    <xsd:restriction base="xsd:string">
                        <xsd:pattern value=".+"/>
                    </xsd:restriction>
                </xsd:simpleType>
            </xsd:element>
            <xsd:element name="port" minOccurs="1" maxOccurs="1">
                <xsd:simpleType>
                    <xsd:restriction base="xsd:string">
                        <xsd:pattern value="\d+"/>
                    </xsd:restriction>
                </xsd:simpleType>
            </xsd:element>
            <xsd:element name="user" minOccurs="1" maxOccurs="1">
                <xsd:simpleType>
                    <xsd:restriction base="xsd:string">
                        <xsd:pattern value=".+"/>
                    </xsd:restriction>
                </xsd:simpleType>
            </xsd:element>
            <xsd:choice>
                <xsd:element name="password" minOccurs="1" maxOccurs="1">
                    <xsd:simpleType>
                        <xsd:restriction base="xsd:string">
                            <xsd:pattern value=".+"/>
                        </xsd:restriction>
                    </xsd:simpleType>
                </xsd:element>
                <xsd:element name="key" minOccurs="1" maxOccurs="1">
                    <xsd:simpleType>
                        <xsd:restriction base="xsd:string">
                            <xsd:pattern value=".+"/>
                        </xsd:restriction>
                    </xsd:simpleType>
                </xsd:element>
            </xsd:choice>
        </xsd:sequence>
    </xsd:complexType>
</xsd:schema>